{
  "schema_version": "1.0.0",
  "analysis_id": "analysis-0190-missing-ball",
  "analysis_version": "provider-build-2026-08-07.1",
  "ai_job_id": "018f6d86-2d8c-7f10-9c1b-0f0c32aa6001",
  "rally_submission_id": "018f6d86-2d8c-7f10-9c1b-0f0c32aa3101",
  "rally_id": "018f6d86-2d8c-7f10-9c1b-0f0c32aa3001",
  "match_id": "018f6d86-2d8c-7f10-9c1b-0f0c32aa1001",
  "annotation_revision": "14",
  "clip_asset_id": "018f6d86-2d8c-7f10-9c1b-0f0c32aa5001",
  "input_clip_sha256": "9a31d43d2c2aeb1a1a98beec4ff8bbd649f68f16eb7345a51fd61a3b302543aa",
  "producer": {
    "name": "fixture-provider",
    "build_id": "fixture-1",
    "sdk_version": "0.1.0"
  },
  "tracks": [
    {
      "track_id": 8,
      "court_side": "left",
      "first_frame_index": "0",
      "last_frame_index": "1078"
    },
    {
      "track_id": 3,
      "court_side": "right",
      "first_frame_index": "0",
      "last_frame_index": "1078"
    },
    {
      "track_id": 4,
      "court_side": "right",
      "first_frame_index": "0",
      "last_frame_index": "1078"
    }
  ],
  "contact_events": [
    {
      "key_point_id": "018f6d86-2d8c-7f10-9c1b-0f0c32aa4000",
      "sequence_index": 0,
      "marker_kind": "service",
      "is_terminal": false,
      "anchor_frame_index": "300",
      "resolved_frame_index": "301",
      "association_state": "resolved_single",
      "actors": [
        {
          "track_id": 8,
          "frame_bbox": {
            "x1": 0.04,
            "y1": 0.22,
            "x2": 0.14,
            "y2": 0.84
          },
          "frame_foot_pos": {
            "x": 0.09,
            "y": 0.84
          },
          "court_pos": {
            "x": -0.06,
            "y": 0.24
          },
          "observation_frame_index": "301"
        }
      ],
      "actor_candidates": [],
      "ball": {
        "state": "observed",
        "sample_frame_index": "301",
        "frame_pos": {
          "x": 0.11,
          "y": 0.47
        }
      },
      "representative_court_positions": [
        {
          "track_id": 8,
          "basis": "player_footprint_proxy",
          "court_pos": {
            "x": -0.06,
            "y": 0.24
          }
        }
      ],
      "quality_flags": []
    },
    {
      "key_point_id": "018f6d86-2d8c-7f10-9c1b-0f0c32aa4001",
      "sequence_index": 1,
      "marker_kind": "contact",
      "is_terminal": false,
      "anchor_frame_index": "420",
      "resolved_frame_index": "419",
      "association_state": "resolved_single",
      "actors": [
        {
          "track_id": 3,
          "frame_bbox": {
            "x1": 0.63,
            "y1": 0.28,
            "x2": 0.72,
            "y2": 0.83
          },
          "frame_foot_pos": {
            "x": 0.675,
            "y": 0.83
          },
          "court_pos": {
            "x": 0.72,
            "y": 0.64
          },
          "action": {
            "label": "provider-action-17",
            "taxonomy_id": "provider-taxonomy",
            "taxonomy_version": "v1"
          },
          "observation_frame_index": "419"
        }
      ],
      "actor_candidates": [],
      "ball": {
        "state": "missing"
      },
      "representative_court_positions": [
        {
          "track_id": 3,
          "basis": "player_footprint_proxy",
          "court_pos": {
            "x": 0.72,
            "y": 0.64
          }
        }
      ],
      "quality_flags": [
        "ball_missing_actor_resolved_from_other_evidence"
      ]
    },
    {
      "key_point_id": "018f6d86-2d8c-7f10-9c1b-0f0c32aa4002",
      "sequence_index": 2,
      "marker_kind": "contact",
      "is_terminal": true,
      "anchor_frame_index": "480",
      "association_state": "no_player",
      "actors": [],
      "actor_candidates": [],
      "ball": {
        "state": "missing"
      },
      "representative_court_positions": [
        {
          "track_id": null,
          "basis": "terminal_projection",
          "court_pos": {
            "x": 1.04,
            "y": 0.79
          }
        }
      ],
      "quality_flags": [
        "ball_missing_terminal_projection_used"
      ]
    }
  ],
  "path_segments": [
    {
      "sequence_index": 0,
      "start_key_point_id": "018f6d86-2d8c-7f10-9c1b-0f0c32aa4000",
      "end_key_point_id": "018f6d86-2d8c-7f10-9c1b-0f0c32aa4001",
      "start_frame_index": "301",
      "end_frame_index": "419",
      "start_court_positions": [
        {
          "track_id": 8,
          "basis": "player_footprint_proxy",
          "court_pos": {
            "x": -0.06,
            "y": 0.24
          }
        }
      ],
      "end_court_positions": [
        {
          "track_id": 3,
          "basis": "player_footprint_proxy",
          "court_pos": {
            "x": 0.72,
            "y": 0.64
          }
        }
      ],
      "render_state": "complete",
      "is_terminal_segment": false,
      "quality_flags": []
    },
    {
      "sequence_index": 1,
      "start_key_point_id": "018f6d86-2d8c-7f10-9c1b-0f0c32aa4001",
      "end_key_point_id": "018f6d86-2d8c-7f10-9c1b-0f0c32aa4002",
      "start_frame_index": "419",
      "end_frame_index": "480",
      "start_court_positions": [
        {
          "track_id": 3,
          "basis": "player_footprint_proxy",
          "court_pos": {
            "x": 0.72,
            "y": 0.64
          }
        }
      ],
      "end_court_positions": [
        {
          "track_id": null,
          "basis": "terminal_projection",
          "court_pos": {
            "x": 1.04,
            "y": 0.79
          }
        }
      ],
      "render_state": "complete",
      "is_terminal_segment": true,
      "quality_flags": [
        "terminal_projection"
      ]
    }
  ],
  "summary": {
    "track_count": 3,
    "contact_event_count": 3,
    "path_segment_count": 2,
    "unresolved_event_count": 0,
    "multiple_event_count": 0,
    "warnings": []
  },
  "extensions": {}
}
